{
  "$schema": "https://json-schema.org/draft/2020-12/schema",
  "title": "RecCenter",
  "type": "object",
  "required": [
    "id",
    "name",
    "address",
    "village_id"
  ],
  "properties": {
    "id": {
      "type": "integer"
    },
    "name": {
      "type": "string"
    },
    "address": {
      "type": "string"
    },
    "phone": {
      "type": [
        "string",
        "null"
      ]
    },
    "village_id": {
      "type": "integer"
    }
  }
}
